{
  "version": "0.1",
  "id": "guided",
  "displayName": "Guided",
  "description": "Deferred low-friction profile for post-v0.1 onboarding.",
  "status": "deferred",
  "inherits": ["base"],
  "supportedPlatforms": ["darwin"],
  "uiMode": "guided",
  "channel": "stable",
  "selectable": false,
  "managedTools": ["claude", "codex", "pi"],
  "binaryRequirements": [
    {
      "id": "pi",
      "displayName": "Pi Coding Agent",
      "required": true,
      "managedByGuy": true,
      "verifyCommand": "pi list",
      "installCommand": "npm install -g @mariozechner/pi-coding-agent",
      "installHint": "npm install -g @mariozechner/pi-coding-agent"
    }
  ],
  "assetManifest": "./assets.json",
  "doctorChecks": ["runtime-state", "managed-assets", "pi", "platform"],
  "postInstall": []
}
